{
  "supplier_name": "Ginevan-Powell",
  "supplier_vat_number": "IE9467819E",
  "customer_name": "Borland, Dowd and Spain",
  "invoice_number": "INV-2026-0009",
  "invoice_date": "2026-10-07",
  "due_date": "2026-11-06",
  "currency": "EUR",
  "net_amount": "2490.73",
  "vat_amount": "572.87",
  "total_amount": "3063.60",
  "category": "Maintenance"
}
