{
  "supplier_name": "McCourt-McGlinchey",
  "supplier_vat_number": "IE5825159H",
  "customer_name": "Scullion, Cormy and May",
  "invoice_number": "INV-2026-0002",
  "invoice_date": "2026-06-24",
  "due_date": "2026-07-24",
  "currency": "EUR",
  "net_amount": "1029.97",
  "vat_amount": "236.89",
  "total_amount": "1266.86",
  "category": "Utilities"
}
