{
  "supplier_name": "Wright Inc",
  "supplier_vat_number": "IE9802987P",
  "customer_name": "Desmond, Fitzsimons and Donagher",
  "invoice_number": "SI-2026-0014",
  "invoice_date": "2026-09-23",
  "due_date": "2026-10-23",
  "currency": "EUR",
  "net_amount": "1371.53",
  "vat_amount": "185.16",
  "total_amount": "1556.69",
  "category": "Software"
}
